{
  "narration": {
    "en": {
      "sentences": [
        {
          "id": "v-1",
          "text": "Two steps here are carried by sources outside the story: a program serving 63.13 million recipients as of May 2026, and recipients, most of them schoolchildren, falling ill after eating its meals.",
          "els": [
            "panel-claim-map",
            "s-program",
            "s-poisoning",
            "e-serve-poison"
          ]
        },
        {
          "id": "v-2",
          "text": "The step no source takes is the last one, from one agency's own running count to that count standing as the full national scale of the harm.",
          "els": [
            "s-count",
            "s-scale",
            "e-count-scale"
          ]
        },
        {
          "id": "v-3",
          "text": "By 1 October 2025 three ledgers stood at three different places: BGN, the agency running the program, at 6,517 people; BPOM, the food and drug regulator, at 9,089 people; and JPPI, a civil-society network, at 8,649 children through 27 September.",
          "els": [
            "panel-dueling",
            "d-bgn",
            "d-bpom",
            "d-jppi",
            "e-poison-count"
          ]
        },
        {
          "id": "v-4",
          "text": "None of the three publishes the rule that decides what enters it, the served base it accumulated on, or the school outbreak ledger that was already being kept before the program existed.",
          "els": [
            "h-count-method",
            "h-denominator-served",
            "h-baseline-klb"
          ]
        },
        {
          "id": "v-5",
          "text": "Outside the totals stand the people who meet each case first: households arranging care the same day, and the puskesmas and district health offices whose investigations turn an incident into the KLB record the national argument is fought over.",
          "els": [
            "panel-incidence",
            "i-households",
            "i-frontline",
            "h-first-payers",
            "h-surveillance-ledger"
          ]
        },
        {
          "id": "v-6",
          "text": "29,679 SPPG kitchens were operating as of May 2026, inside a program that counts 1.28 million program workers at the same date, and a service unit cooked every counted meal, though which service units the counted cases trace back to is published beside none of the three totals.",
          "els": [
            "i-kitchens",
            "h-kitchens"
          ]
        }
      ]
    },
    "id": {
      "sentences": [
        {
          "id": "v-1",
          "text": "Program Makan Bergizi Gratis berjalan dalam skala nasional, dengan 63,13 juta penerima per Mei 2026, dan langkah dari program itu ke penerima yang jatuh sakit ditopang sumber di luar artikelnya sendiri.",
          "els": [
            "panel-claim-map",
            "s-program",
            "s-poisoning",
            "e-serve-poison"
          ]
        },
        {
          "id": "v-2",
          "text": "Rantainya berhenti di langkah terakhir: tidak ada sumber dalam registri yang menyatakan hitungan berjalan sebuah badan adalah ukuran utuh skala keracunan secara nasional.",
          "els": [
            "panel-claim-map",
            "s-count",
            "s-scale",
            "e-count-scale"
          ]
        },
        {
          "id": "v-3",
          "text": "Titik tempat sumber-sumber itu berpisah adalah hitungannya: BGN mencatat 6.517 orang sejak Januari 2025, BPOM 9.089 orang per 1 Oktober 2025, dan JPPI 8.649 anak per 27 September 2025.",
          "els": [
            "panel-dueling",
            "e-poison-count",
            "d-bgn",
            "d-bpom",
            "d-jppi"
          ]
        },
        {
          "id": "v-4",
          "text": "Ketiganya dibiarkan berdampingan tanpa dilebur, sebab tiap total lahir dari aturan hitung, jendela waktu, dan satuan yang berbeda, sementara definisi kasus di balik masing-masing angka tidak pernah diumumkan.",
          "els": [
            "panel-dueling",
            "s-count",
            "h-count-method"
          ]
        },
        {
          "id": "v-5",
          "text": "Penyebutnya juga belum dibuka: berapa penerima dan porsi yang tersalurkan pada rentang bulan yang sama, dan seberapa sering keracunan pangan di lingkungan sekolah tercatat sebelum program ini ada.",
          "els": [
            "h-denominator-served",
            "h-baseline-klb",
            "s-scale"
          ]
        },
        {
          "id": "v-6",
          "text": "Di luar bingkai berdiri keluarga yang mengurus perawatan pada hari yang sama, puskesmas dan dinas kesehatan yang membuka catatan KLB, dan 29.679 dapur SPPG yang beroperasi per Mei 2026 bersama kru serta pemasok lokal yang ikut berhenti ketika sebuah unit berhenti memasak.",
          "els": [
            "panel-incidence",
            "i-households",
            "i-frontline",
            "i-kitchens",
            "h-first-payers",
            "h-surveillance-ledger",
            "h-kitchens"
          ]
        }
      ]
    }
  },
  "sparring": {
    "questions": [
      {
        "move": "mechanism",
        "q": {
          "en": "Three institutions publish three different totals for the same program. What is doing most of the work in that gap?",
          "id": "Tiga lembaga menerbitkan tiga total berbeda untuk program yang sama. Apa yang paling menentukan jarak di antaranya?"
        },
        "options": [
          {
            "en": "Each total is built from a different counting rule, over a different window, with a different unit.",
            "id": "Tiap total dibangun dari aturan hitung yang berbeda, pada jendela waktu yang berbeda, dengan satuan yang berbeda."
          },
          {
            "en": "More outlets repeated the larger figures, so those totals grew.",
            "id": "Lebih banyak media mengulang angka yang besar, sehingga total itu ikut membesar."
          },
          {
            "en": "The largest figure is simply the most recent one, and the others lag behind it.",
            "id": "Angka terbesar sekadar angka paling baru, sedangkan sisanya tertinggal di belakangnya."
          }
        ],
        "correct": 0,
        "note": {
          "en": "The three counts panel puts the methods side by side: BGN keeps a running count of people inside its own program, BPOM sums victims from verified KLB events across regions, JPPI tallies children reported affected through 27 September 2025. BGN and BPOM even stand on the same date, 1 October 2025, at 6,517 people and 9,089 people. Elapsed time alone therefore does not hold the gap, and the panel's rule line keeps the three counts standing separately rather than merged.",
          "id": "Panel tiga hitungan menaruh metodenya berdampingan: BGN memegang hitungan berjalan atas orang di dalam programnya sendiri, BPOM menjumlahkan korban dari kejadian luar biasa yang diverifikasi lintas daerah, JPPI menabulasi anak yang dilaporkan terdampak hingga 27 September 2025. BGN dan BPOM bahkan berdiri pada tanggal yang sama, 1 Oktober 2025, pada 6.517 orang dan 9.089 orang. Jadi selisih waktu saja tidak menampung jarak itu, dan baris aturan panel menahan ketiga hitungan tetap berdiri terpisah alih-alih dilebur."
        }
      },
      {
        "move": "denominator",
        "q": {
          "en": "The counts are published as cumulative totals. What are they placed over?",
          "id": "Hitungan itu diumumkan sebagai total kumulatif. Di atas basis apa angka itu diletakkan?"
        },
        "options": [
          {
            "en": "Over the recipients and portions the program served across the same months.",
            "id": "Di atas penerima dan porsi yang tersalurkan pada rentang bulan yang sama."
          },
          {
            "en": "Over the number of SPPG kitchens that cooked the program's meals.",
            "id": "Di atas jumlah dapur SPPG yang memasak menu program."
          },
          {
            "en": "Over nothing. No served base for the same window is published beside any of the three totals.",
            "id": "Tidak di atas basis apa pun. Tidak ada basis penyaluran untuk rentang yang sama yang diumumkan berdampingan dengan satu pun dari tiga total itu."
          }
        ],
        "correct": 2,
        "note": {
          "en": "The registry does carry served figures, 63.13 million recipients and 29,679 SPPG kitchens operating, but both stand at May 2026 while the counts stop at 27 September and 1 October 2025. Nothing lines the two up, so no rate comes out of them, and the served base is logged as one of the parts the story never opens. The kitchen count is a count of places, not of portions eaten, so it cannot carry a case rate either.",
          "id": "Registri memang memuat angka penyaluran, 63,13 juta penerima dan 29.679 dapur SPPG beroperasi, tetapi keduanya berdiri pada Mei 2026 sementara hitungan korban berhenti pada 27 September dan 1 Oktober 2025. Tidak ada yang menyejajarkan keduanya, jadi tidak ada laju kejadian yang bisa dibaca dari sana, dan basis penyaluran itu tercatat sebagai bagian yang belum dibuka. Angka dapur adalah hitungan tempat, bukan hitungan porsi yang dimakan, jadi angka itu juga tidak bisa menopang laju kasus."
        }
      },
      {
        "move": "incidence",
        "q": {
          "en": "One child is counted in an incident. Who meets the cost of that single case first, before it reaches any national total?",
          "id": "Seorang anak terhitung dalam sebuah insiden. Siapa yang lebih dulu menanggung biaya kasus itu, sebelum kasusnya sampai ke total nasional mana pun?"
        },
        "options": [
          {
            "en": "The agency running the program, which logs the case into its national total.",
            "id": "Badan pelaksana program, yang mencatatkan kasus itu ke dalam total nasionalnya."
          },
          {